{
  "report_id": "2_overlay_validation_report",
  "report_type": "OverlaySchemaValidation",
  "run_id": "e23b408e-7b3f-4078-82a5-b9e0d0b28a51",
  "git_commit": "0833c6b031c8a44ce9b78f6bd6658835284a76b9",
  "worktree_dirty": false,
  "command": "python3 tools/verify_spec.py",
  "started_at": "2026-09-27T16:02:12.220+00:00",
  "finished_at": "2026-09-27T16:02:12.220+00:00",
  "duration_ms": 1.256,
  "offline_validated": true,
  "passed": true,
  "score": 100.0,
  "checks": [
    {
      "check_id": "overlay_schema_and_injection_guard",
      "command": "python3 tools/verify_spec.py",
      "exit_code": 0,
      "duration_ms": 0.56,
      "stdout_digest": "",
      "stderr_digest": "",
      "passed": true,
      "details": "兼容 Overlay 通过；未知插槽、可执行注入、错误 lock 与对不上的内核摘要被拒绝"
    },
    {
      "check_id": "placeholder_not_real_manifest",
      "command": "python3 tools/verify_spec.py",
      "exit_code": 0,
      "duration_ms": 0.696,
      "stdout_digest": "",
      "stderr_digest": "",
      "passed": true,
      "details": "placeholder 仅可用于合成样例，真实 Overlay 检查会拒绝"
    }
  ],
  "input_digest": "e3a4b15561f818f2b2747b27763d04e32e8b2eb275ac48112c18f7d8f3ddffef",
  "spec_digest": "1e7cfa756f8ead788236ebaae6b56e301144d435a88343b932e3cd5902fce62f",
  "content_digest": "4a98ec85a2efaa83b6cf7284a10797a5446c0c935df71d35657462fc1ba19769",
  "validation_scope": "offline_contract",
  "real_file_checked": false
}
