{
  "report_id": "5_offline_mcp_safety_report",
  "report_type": "McpOfflineSafetyValidation",
  "run_id": "fa973c2e-d346-4bb1-94d7-c1ec27e44f7e",
  "git_commit": "ef3e6723d2010e0e27f3e7cbf1e8c714c210f8e0",
  "worktree_dirty": false,
  "command": "python3 tools/verify_spec.py",
  "started_at": "2026-09-27T15:56:04.753+00:00",
  "finished_at": "2026-09-27T15:56:04.753+00:00",
  "duration_ms": 0.102,
  "offline_validated": true,
  "passed": true,
  "score": 100.0,
  "checks": [
    {
      "check_id": "offline_mcp_response_semantics",
      "command": "python3 tools/verify_spec.py",
      "exit_code": 0,
      "duration_ms": 0.093,
      "stdout_digest": "",
      "stderr_digest": "",
      "passed": true,
      "details": "快照事实可用；离线数据库结果伪造被拒绝"
    },
    {
      "check_id": "mcp_spec_states",
      "command": "python3 tools/verify_spec.py",
      "exit_code": 0,
      "duration_ms": 0.009,
      "stdout_digest": "",
      "stderr_digest": "",
      "passed": true,
      "details": "True"
    }
  ],
  "input_digest": "faec7c27c6c8edde10f6b8048e7e2c015727130f8a1a68de60463e0f0f1d0eb5",
  "spec_digest": "1e7cfa756f8ead788236ebaae6b56e301144d435a88343b932e3cd5902fce62f",
  "content_digest": "fa77787238494a44818a79437c319183246e5bdca8f53333f98a349015fc4a1d",
  "validation_scope": "offline_contract",
  "real_file_checked": false
}
