{
  "report_id": "8_rollback_drill_report",
  "report_type": "RollbackDrillValidation",
  "run_id": "dc870a03-cf1c-4253-9449-f1776a01f8bf",
  "git_commit": "0833c6b031c8a44ce9b78f6bd6658835284a76b9",
  "worktree_dirty": false,
  "command": "python3 tools/verify_spec.py",
  "started_at": "2026-09-27T16:02:12.269+00:00",
  "finished_at": "2026-09-27T16:02:12.269+00:00",
  "duration_ms": 4.271,
  "offline_validated": true,
  "passed": true,
  "score": 100.0,
  "checks": [
    {
      "check_id": "sqlite_transaction_rollback",
      "command": "python3 tools/verify_spec.py",
      "exit_code": 0,
      "duration_ms": 4.271,
      "stdout_digest": "",
      "stderr_digest": "",
      "passed": true,
      "details": "强制异常后的 SQLite ROLLBACK 保持基线一致"
    }
  ],
  "input_digest": "e3a4b15561f818f2b2747b27763d04e32e8b2eb275ac48112c18f7d8f3ddffef",
  "spec_digest": "1e7cfa756f8ead788236ebaae6b56e301144d435a88343b932e3cd5902fce62f",
  "content_digest": "1c6d63efe71584c1256949db02f40c12d3bea7975d5f67b4673001aca028a2fb",
  "validation_scope": "offline_contract",
  "real_file_checked": false
}
