{
  "report_id": "4_coordination_state_report",
  "report_type": "CoordinationStateValidation",
  "run_id": "c065a599-46ac-4f1a-a1c4-a058f64d37da",
  "git_commit": "ef3e6723d2010e0e27f3e7cbf1e8c714c210f8e0",
  "worktree_dirty": false,
  "command": "python3 tools/verify_spec.py",
  "started_at": "2026-09-27T15:56:04.746+00:00",
  "finished_at": "2026-09-27T15:56:04.746+00:00",
  "duration_ms": 10.973,
  "offline_validated": true,
  "passed": true,
  "score": 100.0,
  "checks": [
    {
      "check_id": "coordination_cas_fencing_outbox",
      "command": "python3 tools/verify_spec.py",
      "exit_code": 0,
      "duration_ms": 5.61,
      "stdout_digest": "",
      "stderr_digest": "",
      "passed": true,
      "details": "SQLite CAS、actor 隔离、stale fencing 拒绝、事务 Outbox 导出通过"
    },
    {
      "check_id": "coordination_schema_consistency",
      "command": "python3 tools/verify_spec.py",
      "exit_code": 0,
      "duration_ms": 5.363,
      "stdout_digest": "",
      "stderr_digest": "",
      "passed": true,
      "details": "{'event_count': 13, 'transition_count': 14}"
    }
  ],
  "input_digest": "faec7c27c6c8edde10f6b8048e7e2c015727130f8a1a68de60463e0f0f1d0eb5",
  "spec_digest": "1e7cfa756f8ead788236ebaae6b56e301144d435a88343b932e3cd5902fce62f",
  "content_digest": "bc349faf773654362e35a6599a4ebd8caf1ea1d09f1c35c1c1b4176beef013c5",
  "validation_scope": "offline_contract",
  "real_file_checked": false
}
