{
  "report_id": "9_token_efficiency_report",
  "report_type": "TokenEfficiencyValidation",
  "run_id": "1390141f-5360-4fce-95b3-970ae595b7f2",
  "git_commit": "0833c6b031c8a44ce9b78f6bd6658835284a76b9",
  "worktree_dirty": false,
  "command": "python3 tools/verify_spec.py",
  "started_at": "2026-09-27T16:02:12.258+00:00",
  "finished_at": "2026-09-27T16:02:12.258+00:00",
  "duration_ms": 1.743,
  "offline_validated": true,
  "passed": true,
  "score": 100.0,
  "checks": [
    {
      "check_id": "token_context_budget_and_dedup",
      "command": "python3 tools/verify_spec.py",
      "exit_code": 0,
      "duration_ms": 1.743,
      "stdout_digest": "",
      "stderr_digest": "",
      "passed": true,
      "details": "常驻技能、单技能任务上下文和重复指令比例均在预算内；安全/隐私/验证规则保留声明存在"
    }
  ],
  "input_digest": "e3a4b15561f818f2b2747b27763d04e32e8b2eb275ac48112c18f7d8f3ddffef",
  "spec_digest": "1e7cfa756f8ead788236ebaae6b56e301144d435a88343b932e3cd5902fce62f",
  "content_digest": "8fb85280bbd56a86de770d2d167857aba068f92553358e7e34543c6a138a5b9c",
  "validation_scope": "offline_contract",
  "real_file_checked": false
}
