{
  "report_id": "1_skill_migration_report",
  "report_type": "SkillMigrationValidation",
  "run_id": "b05e7b4b-b0ed-4371-aa45-3d32eb0ae196",
  "git_commit": "ef3e6723d2010e0e27f3e7cbf1e8c714c210f8e0",
  "worktree_dirty": false,
  "command": "python3 tools/verify_spec.py",
  "started_at": "2026-09-27T15:56:04.727+00:00",
  "finished_at": "2026-09-27T15:56:04.727+00:00",
  "duration_ms": 198.835,
  "offline_validated": true,
  "passed": true,
  "score": 100.0,
  "checks": [
    {
      "check_id": "legacy_skill_coverage_and_alias",
      "command": "python3 tools/verify_spec.py",
      "exit_code": 0,
      "duration_ms": 198.835,
      "stdout_digest": "",
      "stderr_digest": "",
      "passed": true,
      "details": "9 个 canonical、26 个 legacy alias、兼容别名解析通过"
    }
  ],
  "input_digest": "faec7c27c6c8edde10f6b8048e7e2c015727130f8a1a68de60463e0f0f1d0eb5",
  "spec_digest": "1e7cfa756f8ead788236ebaae6b56e301144d435a88343b932e3cd5902fce62f",
  "content_digest": "a430152fef16b798c2a0e5e2c47af67357931fb500b681da4b50a581ecf105b5",
  "validation_scope": "offline_contract",
  "real_file_checked": false
}
