{
  "report_id": "7_sandbox_regression_report",
  "report_type": "SandboxContractRegression",
  "run_id": "e2a7b7c4-43c0-43fe-be4a-af8d0a0ae5c3",
  "git_commit": "0833c6b031c8a44ce9b78f6bd6658835284a76b9",
  "worktree_dirty": false,
  "command": "python3 tools/verify_spec.py",
  "started_at": "2026-09-27T16:02:12.252+00:00",
  "finished_at": "2026-09-27T16:02:12.252+00:00",
  "duration_ms": 331.675,
  "offline_validated": true,
  "passed": true,
  "score": 100.0,
  "checks": [
    {
      "check_id": "spec_json_syntax",
      "command": "python3 tools/verify_spec.py",
      "exit_code": 0,
      "duration_ms": 0.532,
      "stdout_digest": "",
      "stderr_digest": "",
      "passed": true,
      "details": "所有 JSON Schema 可解析"
    },
    {
      "check_id": "contract_unit_tests",
      "command": "python3 -m unittest discover -s agent-skills/tests -p test_contracts.py",
      "exit_code": 0,
      "duration_ms": 112.964,
      "stdout_digest": "e3b0c44298fc1c149afbf4c8996fb92427ae41e4649b934ca495991b7852b855",
      "stderr_digest": "b0dd04239029a366af42e7a16c28cfbd2a9f7d5319e0614ad07a350ecb2ef585",
      "passed": true,
      "details": ".....\n----------------------------------------------------------------------\nRan 5 tests in 0.055s\n\nOK"
    },
    {
      "check_id": "action_context_regression",
      "command": "python3 -m unittest discover -s agent-skills/tests -p test_action_context.py",
      "exit_code": 0,
      "duration_ms": 139.379,
      "stdout_digest": "e3b0c44298fc1c149afbf4c8996fb92427ae41e4649b934ca495991b7852b855",
      "stderr_digest": "5684d13977a1f6829bcd5f644c72b35ab6f8d42951d571a5f230c4cc35a359f3",
      "passed": true,
      "details": ".........\n----------------------------------------------------------------------\nRan 9 tests in 0.007s\n\nOK"
    },
    {
      "check_id": "token_efficiency_regression",
      "command": "python3 -m unittest discover -s agent-skills/tests -p test_token_efficiency.py",
      "exit_code": 0,
      "duration_ms": 78.8,
      "stdout_digest": "e3b0c44298fc1c149afbf4c8996fb92427ae41e4649b934ca495991b7852b855",
      "stderr_digest": "279538fe812d165bb22f5a84ab94b40efa9072957816601b6c80f1ba281fa35e",
      "passed": true,
      "details": "..\n----------------------------------------------------------------------\nRan 2 tests in 0.013s\n\nOK"
    }
  ],
  "input_digest": "e3a4b15561f818f2b2747b27763d04e32e8b2eb275ac48112c18f7d8f3ddffef",
  "spec_digest": "1e7cfa756f8ead788236ebaae6b56e301144d435a88343b932e3cd5902fce62f",
  "content_digest": "8adcf7f346db5d1d97e1aede46c5e6bb5d069cca76f6e59e614c7a31da95473e",
  "validation_scope": "offline_contract",
  "real_file_checked": false
}
