{
  "report_id": "6_privacy_scan_report",
  "report_type": "PrivacyScanValidation",
  "run_id": "4325c104-5ed6-4a34-93cb-733182dae4fc",
  "git_commit": "ef3e6723d2010e0e27f3e7cbf1e8c714c210f8e0",
  "worktree_dirty": false,
  "command": "python3 tools/verify_spec.py",
  "started_at": "2026-09-27T15:56:04.758+00:00",
  "finished_at": "2026-09-27T15:56:04.758+00:00",
  "duration_ms": 1905.649,
  "offline_validated": true,
  "passed": true,
  "score": 100.0,
  "checks": [
    {
      "check_id": "public_privacy_verify",
      "command": "python3 tools/verify_spec.py",
      "exit_code": 0,
      "duration_ms": 1905.649,
      "stdout_digest": "",
      "stderr_digest": "",
      "passed": true,
      "details": "公开 allowlist 与当前可达 Git 历史扫描通过；已登记历史债务 21 条按 spec/privacy-history-baseline.yaml 放行（仅全历史扫描）"
    }
  ],
  "input_digest": "faec7c27c6c8edde10f6b8048e7e2c015727130f8a1a68de60463e0f0f1d0eb5",
  "spec_digest": "1e7cfa756f8ead788236ebaae6b56e301144d435a88343b932e3cd5902fce62f",
  "content_digest": "4ba1166a512ace197c4d890f4bfc116097013d1751f173671ee60a0057943bd3",
  "validation_scope": "offline_contract",
  "real_file_checked": false
}
