{
  "report_id": "3_adapter_contract_report",
  "report_type": "AdapterContractValidation",
  "run_id": "9ee20501-69cb-4e1e-8431-25dae9b3fd0d",
  "git_commit": "ef3e6723d2010e0e27f3e7cbf1e8c714c210f8e0",
  "worktree_dirty": false,
  "command": "python3 tools/verify_spec.py",
  "started_at": "2026-09-27T15:56:04.740+00:00",
  "finished_at": "2026-09-27T15:56:04.740+00:00",
  "duration_ms": 37.798,
  "offline_validated": true,
  "passed": true,
  "score": 100.0,
  "checks": [
    {
      "check_id": "adapter_capabilities_and_dialog",
      "command": "python3 tools/verify_spec.py",
      "exit_code": 0,
      "duration_ms": 9.385,
      "stdout_digest": "",
      "stderr_digest": "",
      "passed": true,
      "details": "7 个 actor；四工具安装目标、会话、标题和降级策略通过"
    },
    {
      "check_id": "adapter_registry_parity",
      "command": "python3 tools/verify_spec.py",
      "exit_code": 0,
      "duration_ms": 28.413,
      "stdout_digest": "",
      "stderr_digest": "",
      "passed": true,
      "details": "spec / actor / action_context / permissions 四方工具表一致，WorkBuddy 两端结论对齐"
    }
  ],
  "input_digest": "faec7c27c6c8edde10f6b8048e7e2c015727130f8a1a68de60463e0f0f1d0eb5",
  "spec_digest": "1e7cfa756f8ead788236ebaae6b56e301144d435a88343b932e3cd5902fce62f",
  "content_digest": "7b16bf07fba00b0366cd05d26bab1109c03a102622fd500bbe117f9fe698c1da",
  "validation_scope": "offline_contract",
  "real_file_checked": false
}
